,tweet_id,source,text,expanded_urls,rating_numerator,rating_denominator,name,Year,Month,Date,dog_stage,favorite_count,retweet_count,is_quote_status,jpg_url,img_num,p1,p1_conf,p1_dog,p2,p2_conf,p2_dog,p3,p3_conf,p3_dog
1059,681891461017812993,Twitter for iPhone,Say hello to Charlie. He's scholarly af. Quite intimidating with all his pupper knowledge 10/10 even built that fire https://t.co/9KThv6z8u5,https://twitter.com/dog_rates/status/681891461017812993/photo/1,10,10,Charlie,2015,12,29,pupper,2268,744,False,https://pbs.twimg.com/media/CXaQqGbWMAAKEgN.jpg,1,Chihuahua,0.20357,True,doormat,0.134316,False,toy_terrier,0.0844823,True
1060,681694085539872773,Twitter for iPhone,This is Bo. He's a Benedoop Cumbersnatch. Seems frustrated with own feet. Portable as hell. 11/10 very solid pupper https://t.co/TONMhRoQh7,https://twitter.com/dog_rates/status/681694085539872773/photo/1,11,10,Bo,2015,12,29,pupper,11784,3680,False,https://pbs.twimg.com/media/CXXdJ7CVAAALu23.jpg,1,toy_poodle,0.920992,True,miniature_poodle,0.0608572,True,Maltese_dog,0.00606372,True
1061,681654059175129088,Twitter for iPhone,This is Toffee. He's a happy pupper. Appears dangerously fluffy. Extraordinarily spherical. 12/10 would pet firmly https://t.co/oEXEKt3MHu,https://twitter.com/dog_rates/status/681654059175129088/photo/1,12,10,Toffee,2015,12,29,pupper,2411,819,False,https://pbs.twimg.com/media/CXW4wGHWsAE_eBD.jpg,1,Pomeranian,0.800538,True,chow,0.146892,True,Pekinese,0.0376125,True
1062,681610798867845120,Twitter for iPhone,*collapses* 12/10 https://t.co/C7M8mnzHIK,https://twitter.com/dog_rates/status/681610798867845120/photo/1,12,10,,2015,12,28,,1725,416,False,https://pbs.twimg.com/media/CXWRZBgWkAEHMea.jpg,1,toy_poodle,0.8217040000000001,True,miniature_poodle,0.116042,True,Yorkshire_terrier,0.0148472,True
1063,681579835668455424,Twitter for iPhone,This is Apollo. He thought you weren't coming back so he had a mental breakdown. 8/10 we've all been there https://t.co/ojUBrDCHLT,https://twitter.com/dog_rates/status/681579835668455424/photo/1,8,10,Apollo,2015,12,28,,3245,1174,False,https://pbs.twimg.com/media/CXV1Ot_W8AEpkQO.jpg,1,Rottweiler,0.760671,True,Labrador_retriever,0.0965847,True,Staffordshire_bullterrier,0.0403325999999999,True
1064,681523177663676416,Twitter for iPhone,This is Carly. She's actually 2 dogs fused together. Very innovative. Probably has superpowers. 12/10 for double dog https://t.co/GQn2IopLud,https://twitter.com/dog_rates/status/681523177663676416/photo/1,12,10,Carly,2015,12,28,,13141,5188,False,https://pbs.twimg.com/media/CXVBtX_WwAEuqbP.jpg,1,Norfolk_terrier,0.205067,True,German_shepherd,0.160439,True,chow,0.1562339999999999,True
1065,681339448655802368,Twitter for iPhone,This is Asher. He's not wearing a seatbelt or keeping both paws on the wheel. Absolute menace on the roadways. 9/10 https://t.co/V3SWuHACkh,https://twitter.com/dog_rates/status/681339448655802368/photo/1,9,10,Asher,2015,12,28,,8545,3692,False,https://pbs.twimg.com/media/CXSanNkWkAAqR9M.jpg,1,seat_belt,0.5324409999999999,False,Labrador_retriever,0.0946148999999999,True,kuvasz,0.089863,True
1066,681320187870711809,Twitter for iPhone,This is Glacier. He's a very happy pup. Loves to sing in the sunlight. 11/10 https://t.co/jTBPqKgkz7,https://twitter.com/dog_rates/status/681320187870711809/photo/1,11,10,Glacier,2015,12,28,,2404,671,False,https://pbs.twimg.com/media/CXSJGAQUQAAoG9Q.jpg,1,Samoyed,0.362596,True,Eskimo_dog,0.2453949999999999,True,Siberian_husky,0.108232,True
1067,681297372102656000,Twitter for iPhone,"This is actually a lion. We only rate dogs. For the last time please only send dogs. Thank u.
12/10 would still pet https://t.co/Pp26dMQxap",https://twitter.com/dog_rates/status/681297372102656000/photo/1,12,10,actually,2015,12,28,,2955,852,False,https://pbs.twimg.com/media/CXR0WJ_W8AMd_O8.jpg,1,Lhasa,0.482401,True,Shih-Tzu,0.113672,True,Pomeranian,0.0962286,True
1068,681281657291280384,Twitter for iPhone,Meet Sarge. His parents signed him up for dancing lessons but his true passion is roller coasters 11/10 very petable https://t.co/KvVoBIgkje,https://twitter.com/dog_rates/status/681281657291280384/photo/1,11,10,Sarge,2015,12,28,,2957,993,False,https://pbs.twimg.com/media/CXRmDfWWMAADCdc.jpg,1,Saint_Bernard,0.99883,True,Pekinese,0.000391312,True,Great_Pyrenees,0.000223582,True
1069,681261549936340994,Twitter for iPhone,Say hello to Panda. He's a Quackadilly Shooster. Not amused by your fake ball throwing motion. 9/10 would hug lots https://t.co/wL1iDvbcVk,https://twitter.com/dog_rates/status/681261549936340994/photo/1,9,10,Panda,2015,12,27,,1331,235,False,https://pbs.twimg.com/media/CXRTw_5WMAAUDVp.jpg,1,Tibetan_terrier,0.382101,True,miniature_poodle,0.0954294,True,Maltese_dog,0.0657377,True
1070,681231109724700672,Twitter for iPhone,I just love this pic. 11/10 this pupper is going places https://t.co/P16uhh1PbI,https://twitter.com/dog_rates/status/681231109724700672/photo/1,11,10,,2015,12,27,pupper,2232,437,False,https://pbs.twimg.com/media/CXQ4EwQWwAEVaUf.jpg,1,Irish_setter,0.406047,True,cocker_spaniel,0.345646,True,Airedale,0.147912,True
1071,681193455364796417,Twitter for iPhone,This is Aspen. He's astronomically fluffy. I wouldn't stop petting this dog if the world was ending around me 11/10 https://t.co/oBlgL9nxpx,https://twitter.com/dog_rates/status/681193455364796417/photo/1,11,10,Aspen,2015,12,27,,3405,1333,False,https://pbs.twimg.com/media/CXQV03pWYAAVniz.jpg,1,Pomeranian,0.992619,True,keeshond,0.00435645,True,schipperke,0.000814,True
1072,680970795137544192,Twitter for iPhone,I thought I made this very clear. We only rate dogs. Stop sending other things like this shark. Thank you... 9/10 https://t.co/CXSJZ4Stk3,https://twitter.com/dog_rates/status/680970795137544192/photo/1,9,10,,2015,12,27,,2206,583,False,https://pbs.twimg.com/media/CXNLU6wWkAE0OkJ.jpg,1,pug,0.713102,True,whippet,0.0574263,True,quilt,0.0560181,False
1073,680940246314430465,Twitter for iPhone,This is Alice. She's an idiot. 4/10 https://t.co/VQXdwJfkyS,https://twitter.com/dog_rates/status/680940246314430465/photo/1,4,10,Alice,2015,12,27,,2921,935,False,https://pbs.twimg.com/media/CXMvio7WQAAPZJj.jpg,1,soft-coated_wheaten_terrier,0.289598,True,West_Highland_white_terrier,0.157195,True,toy_poodle,0.0744346999999999,True
1074,680934982542561280,Twitter for iPhone,Say hello to Sadie. She's a Tortellini Sidewinder. Very jubilant pup. Seems loyal. Leaves on point. 10/10 petable af https://t.co/g2bTu4ayPl,https://twitter.com/dog_rates/status/680934982542561280/photo/1,10,10,Sadie,2015,12,27,,1909,391,False,https://pbs.twimg.com/media/CXMqwIQWcAA2iE0.jpg,1,Labrador_retriever,0.7843979999999999,True,Siberian_husky,0.0559251,True,beagle,0.0227501,True
1075,680913438424612864,Twitter for iPhone,Meet Griswold. He's dapper as hell. Already pumped for next Christmas. 11/10 https://t.co/5NrpNDyFzN,https://twitter.com/dog_rates/status/680913438424612864/photo/1,11,10,Griswold,2015,12,27,,2207,562,False,https://pbs.twimg.com/media/CXMXKKHUMAA1QN3.jpg,1,Pomeranian,0.615678,True,golden_retriever,0.1264549999999999,True,Chihuahua,0.0871836,True
1076,680889648562991104,Twitter for iPhone,This is Cheesy. It's her birthday. She's patiently waiting to eat her party muffin. 9/10 happy birthday pup https://t.co/cH2H7mch2H,https://twitter.com/dog_rates/status/680889648562991104/photo/1,9,10,Cheesy,2015,12,26,,1609,323,False,https://pbs.twimg.com/media/CXMBhXfWEAA4mMI.jpg,1,Shetland_sheepdog,0.876337,True,collie,0.078331,True,Pomeranian,0.0204075,True
1077,680836378243002368,Twitter for iPhone,This is Ellie. She's secretly ferocious. 12/10 very deadly pupper https://t.co/BF4BW8LUgb,https://twitter.com/dog_rates/status/680836378243002368/photo/1,12,10,Ellie,2015,12,26,pupper,3178,1183,False,https://pbs.twimg.com/media/CXLREjOW8AElfk6.jpg,3,Pembroke,0.427781,True,Shetland_sheepdog,0.160669,True,Pomeranian,0.11125,True
1078,680801747103793152,Twitter for iPhone,Great picture here. Dog on the right panicked &amp; forgot about his tongue. Middle green dog must've fainted. All 10/10 https://t.co/31npKUAox0,https://twitter.com/dog_rates/status/680801747103793152/photo/1,10,10,,2015,12,26,,2184,739,False,https://pbs.twimg.com/media/CXKxkseW8AAjAMY.jpg,1,pug,0.99672,True,Labrador_retriever,0.00143879,True,Staffordshire_bullterrier,0.000517603,True
1079,680609293079592961,Twitter for iPhone,This is Brody. That is his chair. He loves his chair. Never leaves it. 9/10 might be stuck actually https://t.co/WvJRg0XJit,https://twitter.com/dog_rates/status/680609293079592961/photo/1,9,10,Brody,2015,12,26,,2407,623,False,https://pbs.twimg.com/media/CXICiB9UwAE1sKY.jpg,1,French_bulldog,0.700764,True,Chihuahua,0.0723896,True,American_Staffordshire_terrier,0.0396186999999999,True
1080,680494726643068929,Twitter for iPhone,Here we have uncovered an entire battalion of holiday puppers. Average of 11.26/10 https://t.co/eNm2S6p9BD,https://twitter.com/dog_rates/status/680494726643068929/photo/1,26,10,,2015,12,25,,1571,438,False,https://pbs.twimg.com/media/CXGaVxOWAAADjhF.jpg,1,kuvasz,0.438627,True,Samoyed,0.111622,True,Great_Pyrenees,0.0640608,True
1081,680473011644985345,Twitter for iPhone,"This is Hector. He thinks he's a hammer. Silly Hector. You're a pupper, not a hammer. 10/10 https://t.co/OdUFuZIXiI",https://twitter.com/dog_rates/status/680473011644985345/photo/1,10,10,Hector,2015,12,25,pupper,2341,668,False,https://pbs.twimg.com/media/CXGGlzvWYAArPfk.jpg,1,Lakeland_terrier,0.796694,True,West_Highland_white_terrier,0.138709,True,Norwich_terrier,0.0162533999999999,True
1082,680191257256136705,Twitter for iPhone,Here's a sleepy Christmas pupper 11/10 https://t.co/KXg0f8GNQ9,https://twitter.com/dog_rates/status/680191257256136705/photo/1,11,10,,2015,12,25,pupper,1973,441,False,https://pbs.twimg.com/media/CXCGVXyWsAAAVHE.jpg,1,Brittany_spaniel,0.7332529999999999,True,Welsh_springer_spaniel,0.251634,True,English_springer,0.00924321,True
1083,680161097740095489,Twitter for iPhone,Meet Goliath. He's an example of irony. Head is phenomenally round. Wants to be an ornament. 12/10 would hug gently https://t.co/72Dil0Aktw,https://twitter.com/dog_rates/status/680161097740095489/photo/1,12,10,Goliath,2015,12,24,,2135,669,False,https://pbs.twimg.com/media/CXBq6RPWkAAaNuU.jpg,1,bluetick,0.268681,True,miniature_pinscher,0.1256519999999999,True,English_setter,0.0893727,True
1084,680145970311643136,Twitter for iPhone,Say hello to Kawhi. He was doing fine until his hat fell off. He got it back though. 10/10 deep breaths pupper https://t.co/N5pM6WBx7e,https://twitter.com/dog_rates/status/680145970311643136/photo/1,10,10,Kawhi,2015,12,24,pupper,3309,1556,False,https://pbs.twimg.com/media/CXBdJxLUsAAWql2.jpg,1,miniature_poodle,0.457117,True,toy_poodle,0.226481,True,Maltese_dog,0.0676815,True
1085,680130881361686529,Twitter for iPhone,This is Reggie. His Santa hat is a little big. 10/10 he's still having fun https://t.co/w0dcGXq7qK,https://twitter.com/dog_rates/status/680130881361686529/photo/1,10,10,Reggie,2015,12,24,,2109,854,False,https://pbs.twimg.com/media/CXBPbVtWAAA2Vus.jpg,1,Maltese_dog,0.199121,True,West_Highland_white_terrier,0.197897,True,Shih-Tzu,0.15713,True
1086,680115823365742593,Twitter for iPhone,This is Ozzy. He woke up 2 minutes before he had to be ready for the Christmas party. 9/10 classic Ozzy https://t.co/Kt9vmw0Fap,https://twitter.com/dog_rates/status/680115823365742593/photo/1,9,10,Ozzy,2015,12,24,,2490,822,False,https://pbs.twimg.com/media/CXBBurSWMAELewi.jpg,1,pug,0.999365,True,French_bulldog,0.000543615,True,Boston_bull,2.8152800000000003e-05,True
1087,680100725817409536,TweetDeck,This pupper is not coming inside until she catches a snowflake on her tongue. 11/10 the determination is palpable https://t.co/lvMYbmKq8H,https://twitter.com/dog_rates/status/680100725817409536/photo/1,11,10,,2015,12,24,pupper,3296,1245,False,https://pbs.twimg.com/media/CW-loUBWYAAn2Cb.jpg,1,golden_retriever,0.6989609999999999,True,chow,0.145971,True,Pomeranian,0.034888,True
1088,679862121895714818,Twitter for iPhone,"""Dammit hooman I'm jus trynna lik the fler"" 11/10 https://t.co/eRZRI8OTj7",https://twitter.com/dog_rates/status/679862121895714818/photo/1,11,10,,2015,12,24,,2243,554,False,https://pbs.twimg.com/media/CW9a_h1WwAApmAy.jpg,1,EntleBucher,0.5232060000000001,True,Greater_Swiss_Mountain_dog,0.4316569999999999,True,Appenzeller,0.0442079,True
1089,679844490799091713,Twitter for iPhone,This is Willie. He's floating away and needs your assistance. Please someone help Willie. 10/10 https://t.co/MJqygWqt8X,https://twitter.com/dog_rates/status/679844490799091713/photo/1,10,10,Willie,2015,12,24,,2185,686,False,https://pbs.twimg.com/media/CW9K9VeVAAE0j-x.jpg,1,Airedale,0.903832,True,Border_terrier,0.0347125999999999,True,toy_poodle,0.021378,True
1090,679828447187857408,Twitter for iPhone,Everybody look at this beautiful pupper 13/10 https://t.co/hyAC5Hq9GC,https://twitter.com/dog_rates/status/679828447187857408/photo/1,13,10,,2015,12,24,pupper,33062,12539,False,https://pbs.twimg.com/media/CW88XN4WsAAlo8r.jpg,3,Chihuahua,0.346545,True,dalmatian,0.166246,True,toy_terrier,0.117502,True
1091,679777920601223168,Twitter for iPhone,This is Rinna. She's melting. 10/10 get inside pupper https://t.co/PA0czwucsb,https://twitter.com/dog_rates/status/679777920601223168/photo/1,10,10,Rinna,2015,12,23,pupper,2851,994,False,https://pbs.twimg.com/media/CW8OYajUMAAPRoF.jpg,1,bloodhound,0.5288189999999999,True,bull_mastiff,0.4201189999999999,True,French_bulldog,0.00948059,True
1092,679736210798047232,Twitter for iPhone,This pup's name is Sabertooth (parents must be cool). Ears for days. Jumps unannounced. 9/10 would pet diligently https://t.co/iazoiNUviP,https://twitter.com/dog_rates/status/679736210798047232/photo/1,9,10,,2015,12,23,,1907,714,False,https://pbs.twimg.com/media/CW7oelWWcAAhyzz.jpg,1,French_bulldog,0.319139,True,Chihuahua,0.154088,True,Cardigan,0.117688,True
1093,679722016581222400,Twitter for iPhone,This is Mike. He is a Jordanian Frito Pilates. Frowning because he can't see directly in front of him. 8/10 https://t.co/NL5QJwdEpF,https://twitter.com/dog_rates/status/679722016581222400/photo/1,8,10,Mike,2015,12,23,,1534,425,False,https://pbs.twimg.com/media/CW7bkW6WQAAksgB.jpg,1,boxer,0.459604,True,Boston_bull,0.197913,True,French_bulldog,0.0870225,True
1094,679475951516934144,Twitter for iPhone,This is Evy. She doesn't want to be a Koala. 9/10 https://t.co/VITeF0Kl9L,https://twitter.com/dog_rates/status/679475951516934144/photo/1,9,10,Evy,2015,12,23,,1915,578,False,https://pbs.twimg.com/media/CW37xZbUoAAUXe5.jpg,1,Maltese_dog,0.145742,True,toy_poodle,0.139407,True,West_Highland_white_terrier,0.108821,True
1095,679462823135686656,Twitter for iPhone,Meet Hurley. He's the curly one. He hugs every other dog he sees during his walk. 11/10 for spreading the love https://t.co/M6vqkt2GKV,https://twitter.com/dog_rates/status/679462823135686656/photo/1,11,10,Hurley,2015,12,23,,29316,16942,False,https://pbs.twimg.com/media/CW3v1KxW8AAIOuy.jpg,1,toy_poodle,0.62178,True,miniature_poodle,0.197819,True,soft-coated_wheaten_terrier,0.046745,True
1096,679158373988876288,Twitter for iPhone,This is Rubio. He has too much skin. 11/10 https://t.co/NLOHmlENag,https://twitter.com/dog_rates/status/679158373988876288/photo/1,11,10,Rubio,2015,12,22,,19372,7217,False,https://pbs.twimg.com/media/CWza7kpWcAAdYLc.jpg,1,pug,0.272205,True,bull_mastiff,0.25153,True,bath_towel,0.116806,False
1097,679148763231985668,Twitter for iPhone,I know everyone's excited for Christmas but that doesn't mean you can send in reindeer. We only rate dogs... 8/10 https://t.co/eWjWgbOCYL,https://twitter.com/dog_rates/status/679148763231985668/photo/1,8,10,,2015,12,22,,2548,919,False,https://pbs.twimg.com/media/CWzSMmAWsAAyB1u.jpg,1,Italian_greyhound,0.302685,True,hair_slide,0.1242809999999999,False,Afghan_hound,0.059846,True
1098,679132435750195208,Twitter for iPhone,This is Louis. He's a river dancer. His friends think it's badass. All are very supportive. 10/10 for Louis https://t.co/qoIvjKMY58,https://twitter.com/dog_rates/status/679132435750195208/photo/1,10,10,Louis,2015,12,22,,2696,1034,False,https://pbs.twimg.com/media/CWzDWOkXAAAP0k7.jpg,1,Scottish_deerhound,0.1946099999999999,True,Irish_wolfhound,0.162855,True,giant_schnauzer,0.1598369999999999,True
1099,679111216690831360,Twitter for iPhone,This is officially the greatest yawn of all time. 12/10 https://t.co/4R0Cc0sLVE,https://twitter.com/dog_rates/status/679111216690831360/video/1,12,10,officially,2015,12,22,,5417,2305,False,https://pbs.twimg.com/ext_tw_video_thumb/679111114081370114/pu/img/hFca8BHjRopgD0cM.jpg,1,kelpie,0.189423,True,beagle,0.121988,True,basset,0.121171,True
1100,679062614270468097,Twitter for iPhone,This is Chompsky. He lives up to his name. 11/10 https://t.co/Xl37lQEWd0,https://twitter.com/dog_rates/status/679062614270468097/photo/1,11,10,Chompsky,2015,12,21,,15451,7183,False,https://pbs.twimg.com/media/CWyD2HGUYAQ1Xa7.jpg,2,cash_machine,0.802333,False,schipperke,0.0455186,True,German_shepherd,0.0233535,True
1101,678991772295516161,Twitter for iPhone,If your Monday isn't going so well just take a look at this. Both 12/10 https://t.co/GJT6SILPGU,https://twitter.com/dog_rates/status/678991772295516161/photo/1,12,10,,2015,12,21,,2064,1015,False,https://pbs.twimg.com/media/CWxDaXHWsAAWV8W.jpg,1,Eskimo_dog,0.330216,True,Siberian_husky,0.187003,True,Chihuahua,0.10142,True
1102,678969228704284672,Twitter for iPhone,Meet Lola. She's a Metamorphic Chartreuse. Plays with her food. Insubordinate and churlish. Exquisite hardwood 11/10 https://t.co/etpBNXwN7f,https://twitter.com/dog_rates/status/678969228704284672/photo/1,11,10,Lola,2015,12,21,,1497,408,False,https://pbs.twimg.com/media/CWwu6OLUkAEo3gq.jpg,1,Labrador_retriever,0.680251,True,Chesapeake_Bay_retriever,0.201697,True,golden_retriever,0.0196759,True
1103,678800283649069056,Twitter for iPhone,Here's a pupper with some mean tan lines. Snazzy sweater though 12/10 https://t.co/DpCSVsl6vu,https://twitter.com/dog_rates/status/678800283649069056/photo/1,12,10,,2015,12,21,pupper,2350,817,False,https://pbs.twimg.com/media/CWuVQSLW4AAI3w9.jpg,1,Labrador_retriever,0.213673,True,beagle,0.146235,True,Airedale,0.122701,True
1104,678798276842360832,Twitter for iPhone,This is Linda. She fucking hates trees. 7/10 https://t.co/blaY85FIxR,https://twitter.com/dog_rates/status/678798276842360832/photo/1,7,10,Linda,2015,12,21,,3157,1026,False,https://pbs.twimg.com/media/CWuTbAKUsAAvZHh.jpg,1,Airedale,0.583122,True,silky_terrier,0.129567,True,Lakeland_terrier,0.0947266,True
1105,678774928607469569,Twitter for iPhone,This is Tug. He's not required to wear the cone he just wants his voice to project more clearly. 11/10 https://t.co/Sp739Ou2qx,https://twitter.com/dog_rates/status/678774928607469569/photo/1,11,10,Tug,2015,12,21,,2569,819,False,https://pbs.twimg.com/media/CWt-MNIWEAAUC9S.jpg,1,Pembroke,0.194681,True,toy_poodle,0.121821,True,Pomeranian,0.096843,True
1106,678764513869611008,Twitter for iPhone,"Meet Wilson. He got caught humping the futon. He's like ""dude, help me out here"" 10/10 I'd help Wilson out https://t.co/m6XoclB0qv",https://twitter.com/dog_rates/status/678764513869611008/photo/1,10,10,Wilson,2015,12,21,,1478,413,False,https://pbs.twimg.com/media/CWt0ubZWcAAkFER.jpg,1,Irish_terrier,0.696646,True,Australian_terrier,0.0749616,True,Irish_setter,0.0639011999999999,True
1107,678755239630127104,Twitter for iPhone,This is Dash. He didn't think the water would be that cold. Damn it Dash it's December. Think a little. 10/10 https://t.co/NqcOwG8pxW,https://twitter.com/dog_rates/status/678755239630127104/photo/1,10,10,Dash,2015,12,21,,6468,2919,False,https://pbs.twimg.com/media/CWtsSQAUkAAnWws.jpg,1,malamute,0.606654,True,Border_collie,0.193831,True,collie,0.0483781,True
1108,678643457146150913,Twitter for iPhone,Meet Grizz. He just arrived. Couldn't wait until Christmas. Worried bc he saw the swastikas on the carpet. 10/10 https://t.co/QBGwYrT7rv,https://twitter.com/dog_rates/status/678643457146150913/photo/1,10,10,Grizz,2015,12,20,,1876,359,False,https://pbs.twimg.com/media/CWsGnyMVEAAM1Y1.jpg,1,Labrador_retriever,0.338757,True,flat-coated_retriever,0.3044699999999999,True,chest,0.0933923,False
1109,678446151570427904,Twitter for iPhone,Touching scene here. Really stirs up the emotions. The bond between father &amp; son. So beautiful. 10/10 for both pups https://t.co/AJWJHov5gx,https://twitter.com/dog_rates/status/678446151570427904/photo/1,10,10,,2015,12,20,,3646,1371,False,https://pbs.twimg.com/media/CWpTLOYWsAEDhcU.jpg,1,Staffordshire_bullterrier,0.284492,True,Rottweiler,0.189434,True,American_Staffordshire_terrier,0.18943,True
1110,678424312106393600,Twitter for iPhone,This is Crystal. She's a shitty fireman. No sense of urgency. People could be dying Crystal. 2/10 just irresponsible https://t.co/rtMtjSl9pz,https://twitter.com/dog_rates/status/678424312106393600/photo/1,2,10,Crystal,2015,12,20,,4989,2266,False,https://pbs.twimg.com/media/CWo_T8gW4AAgJNo.jpg,1,Maltese_dog,0.759945,True,toy_poodle,0.101194,True,Shih-Tzu,0.0560374,True
1111,678410210315247616,Twitter for iPhone,Say hello to Jerome. He can shoot french fries out of his mouth at insane speeds. Deadly af. 10/10 https://t.co/dIy88HwrX8,https://twitter.com/dog_rates/status/678410210315247616/photo/1,10,10,Jerome,2015,12,20,,3816,1607,False,https://pbs.twimg.com/media/CWoyfMiWUAAmGdd.jpg,1,schipperke,0.145877,True,Labrador_retriever,0.0983538,True,kelpie,0.0973933999999999,True
1112,678399652199309312,Twitter for iPhone,This made my day. 12/10 please enjoy https://t.co/VRTbo3aAcm,https://twitter.com/dog_rates/status/678399652199309312/video/1,12,10,,2015,12,20,,73237,28472,False,https://pbs.twimg.com/ext_tw_video_thumb/678399528077250560/pu/img/BOjUNHRsYLeSo0hl.jpg,1,swing,0.929196,False,Bedlington_terrier,0.0150472,True,Great_Pyrenees,0.0140389,True
1113,678396796259975168,Twitter for iPhone,These little fellas have opposite facial expressions. Both 12/10 https://t.co/LmThv0GWen,https://twitter.com/dog_rates/status/678396796259975168/photo/1,12,10,,2015,12,20,,1453,373,False,https://pbs.twimg.com/media/CWomSU_XIAAUYiK.jpg,2,Pembroke,0.95618,True,Cardigan,0.0318031,True,Chihuahua,0.0062765,True
1114,678389028614488064,Twitter for iPhone,"This is Bella. She just learned that her final grade in chem was a 92.49 
poor pupper 11/10 https://t.co/auOoKuoveM",https://twitter.com/dog_rates/status/678389028614488064/photo/1,11,10,Bella,2015,12,20,pupper,1711,380,False,https://pbs.twimg.com/media/CWofOHUWUAACGVa.jpg,1,miniature_pinscher,0.516284,True,kelpie,0.227402,True,vizsla,0.103246,True
1115,678341075375947776,Twitter for iPhone,This pupper likes tape. 12/10 https://t.co/cSp6w5GWgm,https://twitter.com/dog_rates/status/678341075375947776/photo/1,12,10,,2015,12,19,pupper,1573,472,False,https://pbs.twimg.com/media/CWnznDTU4AAa-6P.jpg,1,golden_retriever,0.853284,True,cocker_spaniel,0.0262298,True,Labrador_retriever,0.0241227999999999,True
1116,678334497360859136,Twitter for iPhone,This is Rosie. She has a snazzy bow tie and a fin for a tail. Probably super fast underwater. Cool socks 10/10 https://t.co/GO76MdGBs0,https://twitter.com/dog_rates/status/678334497360859136/photo/1,10,10,Rosie,2015,12,19,,1181,223,False,https://pbs.twimg.com/media/CWntoDVWcAEl3NB.jpg,1,Norfolk_terrier,0.378643,True,golden_retriever,0.0955939,True,kelpie,0.0853092,True
1117,678278586130948096,Twitter for iPhone,Another spooky pupper here. Most definitely floating. No legs. Probably knows some dark magic. 10/10 very spooked https://t.co/JK8MByRzgj,https://twitter.com/dog_rates/status/678278586130948096/photo/1,10,10,,2015,12,19,pupper,10390,5474,False,https://pbs.twimg.com/media/CWm6xySUEAAqfFU.jpg,1,Maltese_dog,0.897841,True,Lhasa,0.0357175,True,Tibetan_terrier,0.0171074999999999,True
1118,678255464182861824,Twitter for iPhone,This is Jessifer. She is a Bismoth Teriyaki. Flowers being attacked by hurricanes on bandana (rad). 9/10 stellar pup https://t.co/nZhmRwZzWv,https://twitter.com/dog_rates/status/678255464182861824/photo/1,9,10,Jessifer,2015,12,19,,1446,327,False,https://pbs.twimg.com/media/CWmlvxJU4AEAqaN.jpg,1,Chihuahua,0.613819,True,Yorkshire_terrier,0.127931,True,Pomeranian,0.0621243,True
1119,678021115718029313,Twitter for iPhone,This is Reese. He likes holding hands. 12/10 https://t.co/cbLroGCbmh,https://twitter.com/dog_rates/status/678021115718029313/photo/1,12,10,Reese,2015,12,19,,12340,5606,False,https://pbs.twimg.com/media/CWjQm5gXAAA9GkD.jpg,1,miniature_pinscher,0.822048,True,Doberman,0.0960845,True,Rottweiler,0.0327093,True
1120,677918531514703872,Twitter for iPhone,"""Everything looks pretty good in there. Make sure to brush your gums. Been flossing? How's school going?"" Both 10/10 https://t.co/lWL2IMJqLR",https://twitter.com/dog_rates/status/677918531514703872/photo/1,10,10,,2015,12,18,,1215,364,False,https://pbs.twimg.com/media/CWhzTbzWUAAEAUN.jpg,1,Eskimo_dog,0.199347,True,dalmatian,0.153225,True,American_Staffordshire_terrier,0.107798,True
1121,677895101218201600,Twitter for iPhone,Guys this was terrifying. Really spooked me up. We don't rate ghosts. We rate dogs. Please only send dogs... 9/10 https://t.co/EJImi1udYb,https://twitter.com/dog_rates/status/677895101218201600/photo/1,9,10,,2015,12,18,,4386,1837,False,https://pbs.twimg.com/media/CWhd_7WWsAAaqWG.jpg,1,dalmatian,0.550702,True,kuvasz,0.0602264,True,Great_Pyrenees,0.0586309999999999,True
1122,677700003327029250,Twitter for iPhone,This is Ralph. He's an interpretive dancer. 10/10 https://t.co/zoDdPyPFsa,https://twitter.com/dog_rates/status/677700003327029250/photo/1,10,10,Ralph,2015,12,18,,3107,1286,False,https://pbs.twimg.com/media/CWesj06W4AAIKl8.jpg,1,Siberian_husky,0.120849,True,junco,0.0792056,False,malamute,0.0630875,True
